[
  {
    "id": "hmlr-forms",
    "title": "HM Land Registry forms directory",
    "url": "https://www.gov.uk/government/collections/hm-land-registry-forms",
    "authority_type": "official_guidance",
    "jurisdiction": "England and Wales",
    "last_verified_date": "2026-10-27",
    "verification_status": "official_source_checked",
    "scope_note": "Forms as publisher listed, including 26 October 2026 CIT form; file binary revisions not examined",
    "monitor": true,
    "licence": "publisher terms apply; reference/link only",
    "effective_date": null
  },
  {
    "id": "hmlr-guides",
    "title": "HM Land Registry practice guide collection",
    "url": "https://www.gov.uk/government/collections/land-registration-practice-guides",
    "authority_type": "official_guidance",
    "jurisdiction": "England and Wales",
    "last_verified_date": "2026-10-27",
    "verification_status": "official_source_checked",
    "scope_note": "Updated 26 October 2026, including PG84",
    "monitor": true,
    "licence": "publisher terms apply; reference/link only",
    "effective_date": null
  },
  {
    "id": "hmlr-pg1",
    "title": "Practice guide 1: first registrations",
    "url": "https://www.gov.uk/government/publications/first-registrations/practice-guide-1-first-registrations",
    "authority_type": "official_guidance",
    "jurisdiction": "England and Wales",
    "last_verified_date": "2026-10-27",
    "verification_status": "official_source_checked",
    "scope_note": "Form FR1, DL duplicate, supporting root, plan, lease",
    "monitor": true,
    "licence": "publisher terms apply; reference/link only",
    "effective_date": null
  },
  {
    "id": "hmlr-pg8",
    "title": "Practice guide 8: execution of deeds",
    "url": "https://www.gov.uk/government/publications/execution-of-deeds/practice-guide-8-execution-of-deeds",
    "authority_type": "official_guidance",
    "jurisdiction": "England and Wales",
    "last_verified_date": "2026-10-27",
    "verification_status": "official_source_checked",
    "scope_note": "Updated 14 September 2026; prescribed attestation clauses",
    "monitor": true,
    "licence": "publisher terms apply; reference/link only",
    "effective_date": null
  },
  {
    "id": "hmlr-pg12",
    "title": "Practice guide 12: official searches",
    "url": "https://www.gov.uk/government/publications/official-searches-and-outline-applications/practice-guide-12-official-searches-and-outline-applications",
    "authority_type": "official_guidance",
    "jurisdiction": "England and Wales",
    "last_verified_date": "2026-10-27",
    "verification_status": "official_source_checked",
    "scope_note": "Priority period normally ends 30th working day under LRR 2003 rule 131",
    "monitor": true,
    "licence": "publisher terms apply; reference/link only",
    "effective_date": null
  },
  {
    "id": "hmlr-pg19",
    "title": "Practice guide 19: notices and restrictions",
    "url": "https://www.gov.uk/government/publications/notices-restrictions-and-protection-of-third-party-interests-pg19/practice-guide-19-notices-restrictions-and-the-protection-of-third-party-interests-in-the-register",
    "authority_type": "official_guidance",
    "jurisdiction": "England and Wales",
    "last_verified_date": "2026-10-27",
    "verification_status": "official_source_checked",
    "scope_note": "LRA 2002 ss32 and 40",
    "monitor": true,
    "licence": "publisher terms apply; reference/link only",
    "effective_date": null
  },
  {
    "id": "hmlr-pg31",
    "title": "Practice guide 31: discharge of charges",
    "url": "https://www.gov.uk/government/publications/discharge-of-charges-pg31/practice-guide-31-discharges-of-charges",
    "authority_type": "official_guidance",
    "jurisdiction": "England and Wales",
    "last_verified_date": "2026-10-27",
    "verification_status": "official_source_checked",
    "scope_note": "Updated 1 June 2026",
    "monitor": true,
    "licence": "publisher terms apply; reference/link only",
    "effective_date": null
  },
  {
    "id": "hmlr-pg63",
    "title": "Practice guide 63: Land Charges",
    "url": "https://www.gov.uk/government/publications/the-land-charges-registers-and-agricultural-credits-register-registration-official-search-office-copy-and-cancellation-pg63/practice-guide-63-land-charges-applications-for-registration-official-search-office-copy-and-cancellation",
    "authority_type": "official_guidance",
    "jurisdiction": "England and Wales",
    "last_verified_date": "2026-10-27",
    "verification_status": "official_source_checked",
    "scope_note": "Land Charges K15/K16; K15 includes bankruptcy register",
    "monitor": true,
    "licence": "publisher terms apply; reference/link only",
    "effective_date": null
  },
  {
    "id": "hmlr-pg78",
    "title": "Practice guide 78: overseas entities",
    "url": "https://www.gov.uk/government/publications/overseas-entities-pg78/practice-guide-78-overseas-companies-and-limited-liability-partnerships",
    "authority_type": "official_guidance",
    "jurisdiction": "England and Wales",
    "last_verified_date": "2026-10-27",
    "verification_status": "official_source_checked",
    "scope_note": "Updated 21 September 2026; overseas companies, registration constraints",
    "monitor": true,
    "licence": "publisher terms apply; reference/link only",
    "effective_date": null
  },
  {
    "id": "hmlr-fees",
    "title": "HM Land Registry Registration Services fees",
    "url": "https://www.gov.uk/guidance/hm-land-registry-registration-services-fees",
    "authority_type": "official_guidance",
    "jurisdiction": "England and Wales",
    "last_verified_date": "2026-10-27",
    "verification_status": "official_source_checked",
    "scope_note": "Published fee schedule says effective 9 Dec 2024; confirm fee route and scale per transaction",
    "monitor": true,
    "licence": "publisher terms apply; reference/link only",
    "effective_date": null
  },
  {
    "id": "hmlr-tr1",
    "title": "Form TR1 and guide",
    "url": "https://www.gov.uk/government/publications/registered-titles-whole-transfer-tr1",
    "authority_type": "official_form",
    "jurisdiction": "England and Wales",
    "last_verified_date": "2026-10-27",
    "verification_status": "official_source_checked",
    "scope_note": "TR1 page updated 23 January 2024",
    "monitor": true,
    "licence": "publisher terms apply; reference/link only",
    "effective_date": null
  },
  {
    "id": "hmlr-tr1-guide",
    "title": "Completing TR1",
    "url": "https://www.gov.uk/government/publications/registered-titles-whole-transfer-tr1/guidance-completing-form-tr1-for-the-transfer-of-registered-property",
    "authority_type": "official_guidance",
    "jurisdiction": "England and Wales",
    "last_verified_date": "2026-10-27",
    "verification_status": "official_source_checked",
    "scope_note": "Panel 7 must not be amended; date on completion; AP1/FR1",
    "monitor": true,
    "licence": "publisher terms apply; reference/link only",
    "effective_date": null
  },
  {
    "id": "hmlr-ap1",
    "title": "Form AP1",
    "url": "https://www.gov.uk/government/publications/change-the-register-ap1",
    "authority_type": "official_form",
    "jurisdiction": "England and Wales",
    "last_verified_date": "2026-10-27",
    "verification_status": "official_source_checked",
    "scope_note": "Page last updated 23 December 2025",
    "monitor": true,
    "licence": "publisher terms apply; reference/link only",
    "effective_date": null
  },
  {
    "id": "hmlr-fr1",
    "title": "Form FR1",
    "url": "https://www.gov.uk/government/publications/first-application-registration-fr1",
    "authority_type": "official_form",
    "jurisdiction": "England and Wales",
    "last_verified_date": "2026-10-27",
    "verification_status": "official_source_checked",
    "scope_note": "Page updated 18 March 2026",
    "monitor": true,
    "licence": "publisher terms apply; reference/link only",
    "effective_date": null
  },
  {
    "id": "hmlr-ch1",
    "title": "Form CH1",
    "url": "https://www.gov.uk/government/publications/legal-charges-registration-ch1",
    "authority_type": "official_form",
    "jurisdiction": "England and Wales",
    "last_verified_date": "2026-10-27",
    "verification_status": "official_source_checked",
    "scope_note": "Form listed 29 August 2023",
    "monitor": true,
    "licence": "publisher terms apply; reference/link only",
    "effective_date": null
  },
  {
    "id": "hmlr-tp1",
    "title": "Form TP1",
    "url": "https://www.gov.uk/government/publications/registered-titles-part-transfer-tp1",
    "authority_type": "official_form",
    "jurisdiction": "England and Wales",
    "last_verified_date": "2026-10-27",
    "verification_status": "official_source_checked",
    "scope_note": "Form listed 29 August 2023",
    "monitor": true,
    "licence": "publisher terms apply; reference/link only",
    "effective_date": null
  },
  {
    "id": "hmlr-os1",
    "title": "Form OS1",
    "url": "https://www.gov.uk/government/publications/official-search-with-priority-whole-title-os1",
    "authority_type": "official_form",
    "jurisdiction": "England and Wales",
    "last_verified_date": "2026-10-27",
    "verification_status": "official_source_checked",
    "scope_note": "Form listed 28 February 2022",
    "monitor": true,
    "licence": "publisher terms apply; reference/link only",
    "effective_date": null
  },
  {
    "id": "hmlr-k15",
    "title": "Form K15",
    "url": "https://www.gov.uk/government/publications/land-charges-official-search-application-k15",
    "authority_type": "official_form",
    "jurisdiction": "England and Wales",
    "last_verified_date": "2026-10-27",
    "verification_status": "official_source_checked",
    "scope_note": "Form updated 13 April 2026; searches only from 1855",
    "monitor": true,
    "licence": "publisher terms apply; reference/link only",
    "effective_date": null
  },
  {
    "id": "ls-ta",